date_relative,text
1d,"Calling all entrepreneurs working with communities that have been left behind. The Western Union Global Fellowship, powered by Watson Institute , is a fully funded 💯🎓, 16-week program designed to help impact-driven leaders scale their ventures 📈 and create lasting change 🌱✨ 🎯 Key Benefits ✔️ Expert-led entrepreneurship training 📚 ✔️ Global mentorship from top leaders 🌍 ✔️ Pitch coaching & global exposure 🎤 ✔️ Access to powerful global networks 🤝 📅 Application deadline: June 28, 2026 ⏰ 🔗 Learn more and apply here: https://wp.me/p23f03-7PB hashtag # Fellowship hashtag # FullyFunded hashtag # Entrepreneurship hashtag # SocialImpact hashtag # Refugees hashtag # GlobalOpportunities hashtag # Changemakers hashtag # OpportunitiesForYouth"
1d,"🚀✨ Fully Funded Enlight Fellowship 2026 for Global Youth Mental Health Leaders! 🧠🌍💡 🚀 Applications are now open for the fully-funded Enlight Fellowship, powered by Watson Institute and supported by the Enlight Foundation 🌟🤝 This 16-week global program (August 17 – December 18, 2026) is designed for entrepreneurs and community leaders working to improve youth mental wellbeing through innovative and scalable solutions 💭📈🌱 Participants gain access to expert-led training 🎓, mentorship 🤝, personalized life coaching 🧭, and a global network of peers and partners 🌐✨ The program combines virtual learning 💻 with in-person experiences 🏫, beginning with a week-long Immersive designed to build strong relationships 🤝❤️ and set the foundation for growth 🚀 Fellows will also have the opportunity to lead community-based initiatives 🌍, refine their ventures through pitch training 🎤, and present their work at the final Summit 🏆🎉 📅 Priority application deadline: July 5, 2026 ⏰ 🔗 Learn more and apply: https://wp.me/p23f03-kXA hashtag # MentalHealth hashtag # Entrepreneurship hashtag # GlobalLeadership hashtag # Fellowship hashtag # WatsonInstitute hashtag # YouthWellbeing"
1d,"🚀 Fully Funded Global Fellowship 2026 | Watson Institute Flagship Fellowship for Entrepreneurs & Changemakers 🌍💡 🚀 Exciting news! Applications are now open for the Flagship Fellowship 2026, powered by Watson Institute . 💼 This fully-funded Fellowship is designed for entrepreneurs ready to grow their business and expand their community impact. ⭐ Achieve product-market fit ⭐ Scale your venture & ⭐ Perfect your Pitch Join a cohort of like-minded entrepreneurs for a 16-week virtual program! Gain access to: ✅ Expert-led training ✅ Mentorship ✅ Global Community ✅ Pitch Coaching 💡Learn more and apply by 28th June at the link: https://wp.me/p23f03-eu6 🌏 Open to applicants from all over the United States hashtag # Colorado hashtag # Florida hashtag # Sustainability hashtag # SDGs hashtag # Entrepreneurship hashtag # Impact hashtag # Fellowship 🌟"
1d,"Are you passionate about shaping the future and solving global challenges? The NGFP Fellowship 2027 is now OPEN for applications—offering funding, mentorship, and a global platform to grow as a foresight leader! 🔗 Apply here: https://lnkd.in/eX9Z-W2x ✨ What You’ll Get: 💰 $1,000 starter grant for your project 🏆 Chance to win $10,000 grand prize 🌍 Global network of changemakers 🤝 Mentorship from foresight experts 📚 Training in futures & foresight 🎤 Access to global events & opportunities 🎯 Who Can Apply? ✔️ Youth (or older with <1 year experience in foresight) ✔️ Passionate about social & environmental impact ✔️ Working on a bold, future-focused idea ⏳ Deadline: 26 June 2026 🔗 Apply here: https://lnkd.in/eX9Z-W2x 💡 Pro Tip: Focus on a strong, future-oriented project idea with clear long-term impact—show how foresight thinking will help you solve real-world challenges and scale your solution. 🌐 For more fellowship opportunities: https://lnkd.in/eSWnXeGQ 👉 Save this post, apply early, and tag someone who should not miss this! hashtag # Fellowship hashtag # FullyFunded hashtag # NGFP hashtag # Foresight hashtag # FutureLeaders hashtag # YouthOpportunities hashtag # GlobalOpportunities hashtag # Innovation hashtag # Leadership hashtag # ApplyNow hashtag # Scholarships hashtag # CareerGrowth hashtag # Changemakers hashtag # OpportunitiesForYouth 🌍"
1d,"🚀 Fully Funded Google AI Fellowship 2026 for Community Leaders! 🌍🤖 Looking to scale your impact using AI and technology? The Google Data Center Community AI Fellowship is your gateway to global opportunities! Join a fully funded fellowship designed for innovators using AI to solve real-world community challenges. 🎯 Key Benefits ✔️ Fully funded program 💸 ✔️ AI & entrepreneurship training 🤖📚 ✔️ Global mentorship & networking 🌍 ✔️ Access to Google tools & resources 🚀 ✔️ Pitch at a global summit 🎤 📅 Deadline: July 12, 2026 (Priority Deadline) 🔗 Apply Here: https://wp.me/p23f03-dLY 💡 Pro Tip: Highlight measurable impact and how your solution uses AI—this significantly boosts your chances! 🔥 🚀 Discover more global Fellowship & Technology opportunities on Opportunities for Youth (OFY): 👉 https://lnkd.in/eSWnXeGQ 👉 https://lnkd.in/dcRp9feP 📌 Save this post | 🔁 Share | 🏷️ Tag someone who needs to see this! hashtag # Fellowship hashtag # AI hashtag # GoogleFellowship hashtag # Opportunities hashtag # Entrepreneurship hashtag # TechForGood hashtag # YouthOpportunities hashtag # Innovation hashtag # Leadership hashtag # FullyFunded"
