date_relative,text
4d,"🏛 UNESCO MAB Young Scientists Award 2026 – Up to $5,000 Research Grant for Emerging Environmental Scientists Worldwide The UNESCO Man and the Biosphere (MAB) Young Scientists Awards is a prestigious global research grant supporting early-career scientists working in biodiversity conservation, climate change, ecosystem management, and sustainable development within UNESCO Biosphere Reserves. 🌟 Key Benefits: 💰 Research funding up to USD $5,000 🌿 Opportunity to conduct research in UNESCO Biosphere Reserves 🌍 Global recognition under UNESCO’s scientific network 📊 Contribution to real-world climate and biodiversity solutions 🤝 International visibility and academic credibility 🗓️ Deadline: 7th May 2026 🔗 Apply here: https://wp.me/p23f03-ehA 💡 Pro Tip: Focus your proposal on real biosphere reserve challenges and clearly align your research with UNESCO MAB priorities and SDGs. Strong field-based methodologies significantly increase selection chances. hashtag # UNESCO hashtag # ResearchGrant hashtag # EnvironmentalScience hashtag # ClimateChange hashtag # Biodiversity hashtag # YoungScientists hashtag # ScholarshipOpportunities hashtag # Sustainability hashtag # MarineScience hashtag # AcademicOpportunities hashtag # GlobalResearch"
4d,"💻 Use Your Tech Skills to Drive Global Impact in Ghana 💻 The United Nations Population Fund (UNFPA) is hiring an ICT Associate (G7) in Accra to support digital systems, infrastructure, and operations within a global development organization. What you’ll gain: 💻 Hands-on experience managing ICT systems in an international organization 🌍 Opportunity to contribute to global development and humanitarian work 📈 Career growth within the UN system and exposure to global operations 🤝 Work in a diverse, mission-driven environment 📅 Deadline: 09 May 2026 🔗 Learn more: https://wp.me/p23f03-kWE 💡 Pro tip: Highlight your experience with ICT systems, troubleshooting, and any work in large organizations or ERP systems. hashtag # Jobs hashtag # ICTCareers hashtag # UnitedNations hashtag # TechJobs hashtag # GhanaJobs hashtag # GlobalDevelopment hashtag # CareerOpportunity"
5d,"🌍 Opportunity Alert: African Women in Science (AWIS) Program 2027 & 2028 Applications are now open for the AWIS Program, an incredible opportunity for early-career African women scientists working in freshwater, fisheries, aquaculture, and aquatic research. ✨ Benefits: ✔ Leadership & scientific training ✔ Global mentorship ✔ International networking ✔ Research exposure ✔ Possible travel to the US & Canada ✔ Conference presentation opportunity 📅 Deadline: May 8, 2026 (Midnight Eastern Time) 🔗 Read our article here: https://wp.me/p23f03-kUg 💡 Pro Tip: Prepare your CV, references, and written responses in advance because progress may not be saved once you start the application. This is a game-changing opportunity for women in science and sustainability across Africa. hashtag # WomenInScience hashtag # AfricanScientists hashtag # ResearchOpportunity hashtag # Aquaculture hashtag # BlueEconomy hashtag # Leadership hashtag # STEM hashtag # Scholarships hashtag # Fellowship"
5d,"📢 Astra Fellowship 2026: Fully Funded AI Safety Fellowship in the USA | Launch Your Global Tech Career Are you ready to break into the future of artificial intelligence and work on some of the world’s most critical challenges? The Astra Fellowship by Constellation Institute is a fully funded, high-impact AI Safety Fellowship designed to transform ambitious individuals into leaders in AI research, governance, and policy. ✨️ Key Benefits: 💰 Fully funded program with living stipend 💻 Up to $15,000/month in research compute funding ✈️ Visa sponsorship for international applicants 🤝 Direct mentorship from leading AI experts 💼 Strong job placement into top global AI organizations 🗓 Deadline: 3rd May 2026 🔗 Apply Here: https://wp.me/p23f03-gkt 💡 Pro Tip: You do NOT need prior AI safety experience. Applicants from diverse backgrounds (policy, engineering, strategy, etc.) with a strong interest in AI risk and governance are highly encouraged to apply. hashtag # AstraFellowship hashtag # FullyFunded hashtag # AISafety hashtag # TechOpportunities hashtag # GlobalFellowship hashtag # ArtificialIntelligence hashtag # CareerGrowth hashtag # Fellowships2026 hashtag # STEMOpportunities hashtag # AIResearch"
5d,"🚀 Apply Now: Summer School on Managing Africa’s Extractive Future 2026 – Ghana Looking to grow your expertise in Africa’s energy, governance, and extractive industries? This prestigious training in Accra, Ghana offers a powerful learning experience for professionals across Anglophone Africa. ✅ Benefits: • Full & Partial Scholarships Available • Expert-led Training • Conference Access • Pan-African Networking • Mentorship & Alumni Community • Leadership & Policy Skills 📅 Deadline: 8 May 2026 🔗 For more information, read our article here: https://wp.me/p23f03-kLb 💡 Pro Tip: Apply early and clearly explain your professional impact, governance experience, and interest in energy transition issues. hashtag # Scholarships hashtag # AfricaOpportunities hashtag # EnergyTransition hashtag # Leadership hashtag # Governance hashtag # TrainingProgram hashtag # ProfessionalDevelopment hashtag # Ghana hashtag # FullyFunded hashtag # CareerGrowth"
5d,"🌍 WHO is hiring young global health professionals! The World Health Organization is recruiting a Junior Professional Officer (JPO) – Technical Officer in Copenhagen, Denmark. This role focuses on maternal health, newborn care, adolescent health, sexual and reproductive rights, and strengthening health systems across Europe. ✅ Benefits: • International career growth • Work with WHO experts & UN partners • Real global health impact • Leadership development • $4,000 annual training allowance • Possible contract extension ⏰ Deadline: 05 May 2026, 04:59 PM 🔗 For more information, read our article here: https://wp.me/p23f03-kKY 💡 Pro Tip: Tailor your motivation letter with measurable achievements in public health, SRHR, maternal care, or policy work. hashtag # WHO hashtag # GlobalHealth hashtag # PublicHealth hashtag # Jobs hashtag # InternationalDevelopment hashtag # CareerOpportunity hashtag # YouthOpportunities hashtag # HealthCareers hashtag # DenmarkJobs"
5d,"🌍💼 UNAIDS Internship 2026 – Work with the UN on Global HIV/AIDS Response! 👉 Apply Now: https://lnkd.in/ed-bhyed Looking to launch your career in global health, policy, or international development? The UNAIDS Internship Programme 2026 offers a unique opportunity to gain hands-on experience supporting efforts to end AIDS by 2030 🌱 📍 Multiple Locations (Remote + In-Person Options) 📅 Deadline: 30 June 2026 ⏳ Duration: 2–6 months 👉 Apply Now: https://lnkd.in/ed-bhyed ✨ Why You Should Apply 💼 Work with a leading UN global health programme 🌍 Gain international development & policy experience 📊 Build research, communication & programme skills 🤝 Network with global experts & UN agencies 🚀 Strengthen your career in public health & global policy 🎯 Eligibility ✔️ Students or recent graduates (within 1 year) ✔️ Minimum age: 20 years ✔️ Knowledge of at least one UN language 💡 Pro Tip: Tailor your application to highlight experience in public health, HIV/AIDS, social impact, or policy work—and clearly show how your skills align with UNAIDS’ mission of equity and zero discrimination 🚀 🚀 For more internship opportunities worldwide: 👉 https://lnkd.in/e4TpM7qp hashtag # UNAIDS hashtag # UNInternship hashtag # Internship2026 hashtag # GlobalHealth hashtag # PublicHealthCareers hashtag # InternationalDevelopment hashtag # UNJobs hashtag # HIVAwareness hashtag # GlobalCareers hashtag # YouthOpportunities hashtag # PaidInternships hashtag # OpportunitiesForYouth 🌍"
5d,"🌍🚀 NATO Young Professionals Programme 2026 – Fully Paid Global Career Opportunity Ready to launch your global career with NATO? The NATO Young Professionals Programme (YPP) 2026 is now open! This prestigious 3-year rotational programme gives you the chance to work across multiple countries and contribute to global peace and security. Join a dynamic international team and gain hands-on experience across NATO bodies while building a powerful global career. 💼 Benefits 💰 Competitive salary ✈️ Relocation support 🏥 Health insurance 📚 Training & career development 🌍 International work experience 🏖️ 30 days paid leave 📅 Deadline: May 31, 2026 🔗 Apply Here: https://wp.me/p23f03-7qb 💡 Pro Tip: Tailor your application to highlight international experience, policy knowledge, and leadership skills—these are key for selection. 🚀 Discover more global Fellowship & Internship opportunities on Opportunities for Youth (OFY): 👉 https://lnkd.in/eSWnXeGQ 👉 https://lnkd.in/e4TpM7qp 📌 Save this post | 🔁 Share | 🏷️ Tag someone who needs to see this! hashtag # NATO hashtag # YPP2026 hashtag # GlobalCareers hashtag # InternationalJobs hashtag # FullyPaid hashtag # YouthOpportunities hashtag # Leadership hashtag # CareersAbroad hashtag # OFY"
5d,"⚽🔥 GLOBAL FOOTBALL JOB ALERT: Become a Football Innovation Analyst! 🚀 Ready to shape the future of football performance? Right to Dream is hiring a Football Innovation Analyst to work across Europe and Africa, driving cutting-edge strategies, data insights, and real match impact! 🌍 Benefits: ✨ Work with elite academies and clubs 📊 Use data, video & AI tools to transform performance ⚽ Influence real game outcomes and player development 🌐 Travel across Denmark, Egypt & Ghana ⏳ Deadline: 📅 18th May 2026 🔗 Apply Here: https://wp.me/p23f03-l59 💡 Pro Tip: Showcase real examples of how your analysis improved performance—clubs value practical impact more than theory! 📌 Save | 🔁 Share | 🏷️ Tag someone who should see this! hashtag # FootballJobs hashtag # SportsAnalytics hashtag # FootballInnovation hashtag # DataInSports hashtag # GlobalCareers hashtag # RightToDream hashtag # SportsCareers hashtag # AIinSports hashtag # FootballAnalysis ⚽📊🌍"
5d,"Looking to launch your career in international development, migration, or humanitarian work? The IOM Internship Programme 2026 is now open with multiple paid opportunities worldwide — both remote and on-site. 🔗 Apply Now: https://lnkd.in/ee4hSjcC 💼 Why You Should Apply: 💰 Paid internships (stipends available) 🌍 Global locations (Uganda, Iraq, France, Switzerland, Qatar & more) 📊 Hands-on experience in migration, policy & humanitarian work 🤝 Work with a leading UN agency 🧑‍💻 Remote + on-site opportunities 🎯 Who Can Apply: ✔️ Students & recent graduates ✔️ Backgrounds in IR, development, migration, social sciences ✔️ Passion for global impact & humanitarian work 🔗 Apply Now: https://lnkd.in/ee4hSjcC 📅 Deadline: Rolling (varies by position — apply early) 💡 Pro Tip: Tailor your CV and cover letter to highlight migration, research, or humanitarian experience. Even academic projects or volunteer work in related areas can significantly boost your chances. 📣 Apply • Save • Share • Tag someone who should not miss this 🌐 For more internship opportunities worldwide: https://lnkd.in/ec22N8Bc hashtag # UNInternships hashtag # IOM hashtag # PaidInternship hashtag # InternationalDevelopment hashtag # HumanitarianCareers hashtag # Migration hashtag # GlobalCareers hashtag # Students hashtag # Graduates hashtag # InternshipOpportunity hashtag # UnitedNations hashtag # YouthOpportunities hashtag # ApplyNow hashtag # OFY hashtag # CareersAbroad hashtag # DevelopmentJobs hashtag # GlobalJobs"
5d,"🌍💰 $60,000 JUST TECH FELLOWSHIP 2027 – FULLY FUNDED GLOBAL OPPORTUNITY IN TECHNOLOGY & SOCIETY Are you working at the intersection of technology and society? The Just Tech Fellowship 2027 (SSRC) is offering up to $60,000 funding to support your research, creative work, or community project! This prestigious fellowship supports innovative thinkers exploring how technology shapes public life, governance, and society. 💼 Benefits 💰 Up to $60,000 unrestricted funding 🌍 Global recognition & network access 🤝 Mentorship + collaboration opportunities 📊 Support for research, creative & community work 🏆 One-year fellowship (2027) ⏳ Deadline: June 28, 2026 (11:59 PM EST) 🔗 Apply Here: https://wp.me/p23f03-l06 💡 Pro Tip: Submit a bold, interdisciplinary project idea that clearly demonstrates real-world impact and public relevance. 🚀 For more global Fellowship & Tech opportunities, visit Opportunities for Youth (OFY): 👉 https://lnkd.in/eSWnXeGQ 👉 https://lnkd.in/dcRp9feP 📌 Save this post | 🔁 Share | 🏷️ Tag someone who should see this! hashtag # Fellowship2027 hashtag # TechForGood hashtag # SSRC hashtag # Innovation hashtag # ResearchFunding hashtag # FullyFunded hashtag # DigitalSociety hashtag # AI hashtag # PublicPolicy hashtag # OpportunitiesForYouth hashtag # OFY"
5d,"🚀 Finverse Fellowship 2026 is now open! Are you a fintech, NGO, bank, credit union, or financial inclusion organization working to improve financial health outcomes in Asia? This is your chance to access funding, mentorship, and recognition through the Finverse Fellowship by data.org . 💰 Benefits: • Up to USD 10,000 microgrant funding • Access to AI and data learning resources • Certificate courses and mentorship • Networking through the Data and AI Fellows community • Visibility on data.org website, LinkedIn, and newsletters • Exclusive workshops and showcase opportunities 📅 Deadline: Apply by May 29, 2026 🔗 Link: 💡 Pro Tip: https://wp.me/p23f03-l5e Show clearly how your project uses data, AI, or Finverse recommendations to improve financial health outcomes—strong practical impact can make your application stand out. hashtag # FinverseFellowship hashtag # Fellowship2026 hashtag # Microgrant hashtag # FundingOpportunity hashtag # Fintech hashtag # FinancialInclusion hashtag # NGOs hashtag # DataForGood hashtag # AIForImpact hashtag # SocialImpact hashtag # GrantOpportunity hashtag # WomenInFinance hashtag # FinancialHealth hashtag # AsiaOpportunities hashtag # dataorg"
5d,"🌍 AKFC Global Leadership Program 2026: Fully Funded Leadership Opportunity in Canada 🇨🇦 Are you a mid-career professional in Canada ready to lead globally and create real impact? The Aga Khan Foundation Canada Global Leadership Program 2026 is now OPEN! A fully funded leadership program designed to equip Canadian professionals with global insights, leadership skills, and networks to tackle today’s biggest challenges. 🎁 Benefits ✈️ Fully funded travel, accommodation & meals 🧠 Advanced leadership training & global insights 🤝 Network with top professionals & changemakers 🌍 In-person residency in Ottawa 📅 Deadline: May 19, 2026 (11:59 PM ET) 🔗 Apply Here: https://wp.me/p23f03-kOC 💡 Pro Tip: Show clear evidence of your leadership impact and commitment to global issues—this program values purpose-driven professionals. 🚀 For more global Leadership Development & Fellowship opportunities, visit on Opportunities for Youth (OFY): 👉 https://lnkd.in/eMR8WFih 👉 https://lnkd.in/eSWnXeGQ 📌 Save this post | 🔁 Share | 🏷️ Tag someone who should see this! hashtag # Leadership hashtag # Canada hashtag # FullyFunded hashtag # Fellowship hashtag # GlobalLeaders hashtag # ProfessionalDevelopment hashtag # Opportunities hashtag # OFY"
5d,"🌏 Fully Funded PhD in New Zealand 2026! The Wellington Doctoral Scholarships 2026 at Victoria University of Wellington are now open for ambitious researchers worldwide. If you're planning to pursue a PhD in New Zealand, this is your chance to study at a top research university with full financial support. 📍 Study in Wellington — one of the world’s most student-friendly capitals. 🎓 Scholarship Benefits ✅ NZD $32,000 annual stipend ✅ Full domestic tuition fees for up to 3 years ✅ World-class research supervision ✅ Open to international & domestic students 📅 Application Deadlines Applications are considered in three rounds each year: 🗓 1 March 🗓 1 July 🗓 1 November Apply early — especially if you need time for visa processing. 🔗 How to Apply: https://wp.me/p23f03-jII 💡 Pro Tip: Reach out to a potential supervisor before submitting your application. A strong research alignment can significantly increase your chances of selection. hashtag # FullyFundedPhD hashtag # NewZealandScholarships hashtag # PhD2026 hashtag # StudyInNewZealand hashtag # InternationalStudents hashtag # WellingtonDoctoralScholarship hashtag # VictoriaUniversityWellington"
5d,"🏁 On your marks, get set, APPLY! The MSc Motorsport Scholarship Programme is now open — and it’s bigger than ever. In partnership with Mission 44, up to 12 scholarships will be awarded to support underrepresented talent in motorsport engineering. 🚀 Why You Should Apply: Tuition support for eligible MSc Motorsport programmes Access to industry networks Mentorship & career development Direct pathways into motorsport engineering This opportunity supports individuals who are Black or mixed-Black, women, and/or from less advantaged socio-economic backgrounds. 🔗 Check course eligibility and apply: https://wp.me/p23f03-jky ⏳ Pro Tip: Apply early and ensure your MSc programme qualifies before submitting your application. Prepare a strong personal statement highlighting your passion for motorsport and commitment to diversity. hashtag # MScMotorsport hashtag # EngineeringDiversity hashtag # STEMOpportunities hashtag # Scholarships hashtag # Mission44 hashtag # AFBEUK hashtag # DrivenByUs"
5d,"📢 IDRC Step Change Final Evaluation 2026 – Apply for the 9-Month Program Evaluation Contract! The International Development Research Centre (IDRC) is inviting qualified teams, consulting firms, and evaluation experts to submit proposals for the Step Change Final Evaluation under Solicitation Number 26270002. This is a great opportunity for professionals in Monitoring & Evaluation (M&E), international development, policy research, and program impact assessment to work on a high-level international contract with IDRC. ✨ Benefits: ✅ 9-month professional evaluation contract ✅ Work with a globally recognized institution (IDRC) ✅ Strengthen your international consulting portfolio ✅ Opportunity for business partnerships and consortium bids ✅ Contribute to future development programming and policy decisions 📅 Deadline: May 20, 2026 ⏰ 13:00 EDT 🔗 Official tender documents available: https://wp.me/p23f03-l53 💡 Pro Tip: Don’t skip the amendment document released on April 27, 2026—it may contain critical updates that affect your proposal. If your firm lacks certain expertise, consider partnering with another business to submit a stronger bid. hashtag # IDRC hashtag # ConsultingOpportunity hashtag # ProgramEvaluation hashtag # MonitoringAndEvaluation hashtag # TenderOpportunity hashtag # CanadaBuys hashtag # ResearchConsulting hashtag # InternationalDevelopment hashtag # ProposalCall hashtag # EvaluationExperts hashtag # DevelopmentConsulting hashtag # GovernmentContracts hashtag # MEL hashtag # ConsultancyJobs"
5d,"Are you ready to study at one of the world’s most prestigious leadership programs? The Schwarzman Scholars Program 2026 is now open—offering a fully funded master’s degree in China designed to shape the next generation of global leaders. 🔗 Apply Now 👉 https://lnkd.in/eqdY946M If you’re passionate about leadership, global affairs, and creating impact, this opportunity could transform your career trajectory. 🌍 Key Benefits • 🎓 Fully Funded Master’s Degree at Tsinghua University • 🌏 World-Class Leadership Training with a global cohort • 🤝 Access to Influential Mentors & Global Networks • 🚀 Career-Defining International Exposure across sectors ⏰ Application Deadline 📅 September 9, 2026 (3:00 p.m. EDT) 🔗 Apply Now 👉 https://lnkd.in/eqdY946M 💡 Pro Tip The Schwarzman selection process is highly competitive. Focus on clarity of purpose, demonstrated leadership, and real-world impact. The strongest candidates don’t try to “fit in”—they stand out with authenticity and a compelling personal narrative. 📌 Why You Should Apply This program is more than a scholarship—it’s a launchpad into global leadership, connecting you with policymakers, business leaders, and change-makers from around the world. 🔥 Don’t miss this opportunity—apply early, tag someone who should see this, and save this post for later! For more scholarship opportunities, please visit: https://lnkd.in/ezYxTpBe hashtag # SchwarzmanScholars hashtag # FullyFundedScholarship hashtag # StudyInChina hashtag # LeadershipDevelopment hashtag # GlobalOpportunities hashtag # Scholarships2026 hashtag # YouthLeadership hashtag # CareerGrowth hashtag # StudyAbroad hashtag # OpportunitiesForYouth"
5d,"Exciting Fellowship Opportunity for Journalists in Africa! The ICFJ+ is offering a fully supported fellowship for journalists and content creators in Kenya, Senegal, and South Africa to report on literacy and numeracy challenges. 🌍 Be part of a movement to improve education outcomes through impactful storytelling. Benefits include: 🥂	Reporting grants 🤩	Mentorship 📚	Training in education data 💯	Story production support 🌍	Study tours 📅 Deadline: May 10, 2026 (11:59 PM EST) 🔗 Apply here: [ https://wp.me/p23f03-l4T ] 💡 Pro Tip: Focus on solutions-driven journalism and demonstrate how your work can reach decision-makers. hashtag # JournalismFellowship hashtag # AfricaOpportunities hashtag # EducationCrisis hashtag # StorytellingForImpact hashtag # ICFJ"
5d,"💰 Fully Funded Global Leadership Fellowship 2026 in the USA | LeadNext Ambassadors Program Are you a young leader ready to make a global impact? The LeadNext: Ambassadors for a Global Future 2026 Fellowship is now open for applications! This prestigious fully funded leadership program brings together emerging changemakers from the U.S. and Asia-Pacific for world-class training, mentorship, and an international summit in the United States. 🔍 Why You Should Apply: ✈️ Fully funded international travel, accommodation & meals 🤝 Elite leadership training & global mentorship 🌐 Access to a powerful international network 💼 In-person Global Leaders Summit in the USA 📅 Deadline: 5th May 2026 🔗 Apply Here: https://wp.me/p23f03-aVO 💡 Pro Tip: Showcase your real-world impact and leadership experience in your application—focus on how you've created change in your community and your vision for solving global challenges. hashtag # FullyFunded hashtag # Scholarships2026 hashtag # FellowshipOpportunities hashtag # LeadershipDevelopment hashtag # YouthOpportunities hashtag # GlobalLeaders hashtag # StudyAbroad hashtag # CareerGrowth hashtag # OpportunitiesForYouth hashtag # InternationalPrograms"
5d,"Are you passionate about youth mental health, research, and global impact? The Global Youth Mental Health Research Fellowship 2026 is now open—offering a 12-month funded opportunity for early-career professionals to gain hands-on experience and shape solutions for child and adolescent mental health worldwide. 🔗 Apply Here 👉 https://lnkd.in/eWG_ZQAF This prestigious fellowship equips you with the skills, networks, and real-world experience needed to drive impact in global mental health, public health, and youth development. ✨ Why You Should Apply ✔️ Advanced training in global mental health, research methods & data analysis ✔️ Hands-on experience working on real international research projects ✔️ Mentorship from global experts & lived-experience leaders ✔️ Financial support (stipend, research funding & travel opportunities) ✔️ Opportunities for publications, grant writing & global collaboration 📅 Application Deadline 🗓 11 May 2026 🔗 Apply Here 👉 https://lnkd.in/eWG_ZQAF 💡 Pro Tip: Stand out by showing a clear commitment to youth mental health—highlight your research, advocacy work, or lived experience, and how you plan to create impact. 🌍 Why This Matters Mental health is a growing global priority, especially among young people. This fellowship positions you at the forefront of evidence-based solutions, policy influence, and innovation in mental health systems worldwide. 📌 For more health-related opportunities, please check https://lnkd.in/exTejPvc ✅ Apply early (competitive & selective) 💾 Save this post for later 🤝 Tag someone who should not miss this opportunity hashtag # MentalHealth hashtag # GlobalHealth hashtag # YouthMentalHealth hashtag # FellowshipOpportunity hashtag # PublicHealth hashtag # ResearchOpportunities hashtag # YouthDevelopment hashtag # FullyFunded hashtag # GlobalOpportunities hashtag # ApplyNow"
